02:32:01.377887 IP lamp-ubuntu-s-1vcpu-1gb-tor1-01.45047 > 67.207.67.3.domain: 32320+ [1au] A? google.com. (39)
02:32:01.378093 IP lamp-ubuntu-s-1vcpu-1gb-tor1-01.48150 > 67.207.67.3.domain: 35603+ [1au] A? google.com. (39)
02:32:01.379187 IP 67.207.67.3.domain > lamp-ubuntu-s-1vcpu-1gb-tor1-01.48150: 35603 6/0/1 A 142.250.139.102, A 142.250.139.139, A 142.250.139.100, A 142.250.139.101, A 142.250.139.113, A 142.250.139.138 (135)
02:32:01.379279 IP 67.207.67.3.domain > lamp-ubuntu-s-1vcpu-1gb-tor1-01.45047: 32320 6/0/1 A 142.250.137.100, A 142.250.137.138, A 142.250.137.101, A 142.250.137.113, A 142.250.137.139, A 142.250.137.102 (135)
02:32:01.713899 IP lamp-ubuntu-s-1vcpu-1gb-tor1-01.52465 > 67.207.67.3.domain: 48358+ [1au] PTR? 3.67.207.67.in-addr.arpa. (53)
02:32:01.714004 IP lamp-ubuntu-s-1vcpu-1gb-tor1-01.42626 > 67.207.67.3.domain: 34248+ [1au] PTR? 3.67.207.67.in-addr.arpa. (53)
02:32:01.714327 IP 67.207.67.3.domain > lamp-ubuntu-s-1vcpu-1gb-tor1-01.52465: 48358 NXDomain 0/1/1 (120)
02:32:01.714450 IP 67.207.67.3.domain > lamp-ubuntu-s-1vcpu-1gb-tor1-01.42626: 34248 NXDomain 0/1/1 (120)
02:32:07.537872 IP lamp-ubuntu-s-1vcpu-1gb-tor1-01.39544 > 67.207.67.3.domain: 34161+ [1au] PTR? 39.33.203.159.in-addr.arpa. (55)
02:32:07.538372 IP 67.207.67.3.domain > lamp-ubuntu-s-1vcpu-1gb-tor1-01.39544: 34161 NXDomain 0/1/1 (122)
